<?xml version="1.0" encoding="UTF-8"?>
<counters xmlns:xsi="http://www.w3.org/2001/XMLSchema-instance" xsi:noNamespaceSchemaLocation="hexcounters.xsd"
          id="tarawa" title="D-Day at Tarawa" size="15.875" corner="0.05"
          source="Copy_of_D-Day_at_Tarawa_USMC_OOB_Chart_V1.1.pdf; 4-step_Companies.pdf; DDAT-Rules_V13.pdf 2.2-2.26">
  <palette>
    <color id="ink" value="#111111"/>
    <color id="white" value="#ffffff"/>
    <color id="usmc" value="#8a9a3a" name="US Marines"/>
    <color id="cream" value="#f3ead2" name="Japanese"/>
    <color id="jpred" value="#c8202a"/>
    <color id="jpdark" value="#3a3a3a"/>
    <color id="blue" value="#3a78c0"/>
    <color id="orange" value="#f0a020"/>
    <color id="green" value="#5a9a3a"/>
    <color id="grey" value="#8a8a8a"/>
    <color id="teal" value="#2aa198"/>
    <color id="pos-red" value="#d23a3a" name="position colour"/>
    <color id="pos-blue" value="#3b8ed0" name="position colour"/>
    <color id="pos-green" value="#78b23c" name="position colour"/>
    <color id="band-green" value="#2f5f1f" name="replacement counter band"/>
  </palette>
  <styles>
    <style id="us" ground="usmc" text="white" box-stroke="ink"/>
    <style id="jp-elite" ground="cream" text="jpred" box-stroke="jpred"/>
    <style id="jp" ground="cream" text="jpred" box-stroke="white" box-fill="white"/>
    <style id="mk-blue" ground="blue" text="white" box-stroke="white"/>
    <style id="mk-orange" ground="orange" text="ink" box-stroke="ink"/>
    <style id="mk-green" ground="green" text="white" box-stroke="white"/>
    <style id="mk-grey" ground="grey" text="white" box-stroke="white"/>
  </styles>
  <counter id="us-i-3-2" family="unit" name="I/3/2">
    <front style="us">
      <text slot="TC" size="medium" weight="bold">I/3/2</text>
      <symbol icon="infantry"/>
      <steps count="4" max="4" slot="LCOL" color="white"/>
      <text slot="MR" size="small">1|R1</text>
      <glyph kind="diamond" slot="LL" color="ink"/>
      <value>7-2</value>
    </front>
    <back derived="reduced">
      <steps count="3" max="4" slot="LCOL" color="white"/>
      <value>5-2</value>
      <text slot="LR" size="small">BR|RD</text>
    </back>
  </counter>
  <counter id="us-k-3-2" family="unit" name="K/3/2">
    <front style="us">
      <text slot="TC" size="medium" weight="bold">K/3/2</text>
      <symbol icon="infantry"/>
      <steps count="4" max="4" slot="LCOL" color="white"/>
      <text slot="MR" size="small">1|R1</text>
      <glyph kind="triangle" slot="LL" color="ink"/>
      <value>7-2</value>
    </front>
    <back derived="reduced">
      <steps count="3" max="4" slot="LCOL" color="white"/>
      <value>5-2</value>
      <text slot="LR" size="small">BR|RD</text>
    </back>
  </counter>
  <counter id="us-3-a-1-18" family="unit" name="3/A/1/18">
    <front style="us">
      <text slot="TC" size="medium" weight="bold">3/A/1/18</text>
      <symbol icon="engineer"/>
      <steps count="1" max="1" slot="LCOL" color="white"/>
      <text slot="MR" size="small">1|R1</text>
      <glyph kind="circle" slot="LL" color="ink"/>
      <value>2</value>
      <text slot="LR" size="small">DE|FT</text>
    </front>
    <back derived="same"/>
  </counter>
  <counter id="us-3-d-2-18" family="unit" name="3/D/2/18">
    <front style="us">
      <text slot="TC" size="medium" weight="bold">3/D/2/18</text>
      <symbol icon="engineer"/>
      <steps count="1" max="1" slot="LCOL" color="white"/>
      <text slot="MR" size="small">1|R1</text>
      <glyph kind="diamond" slot="LL" color="ink"/>
      <value>2</value>
      <text slot="LR" size="small">SP</text>
    </front>
    <back derived="same"/>
  </counter>
  <counter id="us-e-2-2" family="unit" name="E/2/2">
    <front style="us">
      <text slot="TC" size="medium" weight="bold">E/2/2</text>
      <symbol icon="infantry"/>
      <steps count="4" max="4" slot="LCOL" color="white"/>
      <text slot="MR" size="small">1|R2</text>
      <glyph kind="diamond" slot="LL" color="ink"/>
      <value>7-2</value>
    </front>
    <back derived="reduced">
      <steps count="3" max="4" slot="LCOL" color="white"/>
      <value>5-2</value>
      <text slot="LR" size="small">BR|RD</text>
    </back>
  </counter>
  <counter id="us-f-2-2" family="unit" name="F/2/2">
    <front style="us">
      <text slot="TC" size="medium" weight="bold">F/2/2</text>
      <symbol icon="infantry"/>
      <steps count="4" max="4" slot="LCOL" color="white"/>
      <text slot="MR" size="small">1|R2</text>
      <glyph kind="circle" slot="LL" color="ink"/>
      <value>7-2</value>
    </front>
    <back derived="reduced">
      <steps count="3" max="4" slot="LCOL" color="white"/>
      <value>5-2</value>
      <text slot="LR" size="small">BR|RD</text>
    </back>
  </counter>
  <counter id="us-2-a-1-18" family="unit" name="2/A/1/18">
    <front style="us">
      <text slot="TC" size="medium" weight="bold">2/A/1/18</text>
      <symbol icon="engineer"/>
      <steps count="1" max="1" slot="LCOL" color="white"/>
      <text slot="MR" size="small">1|R2</text>
      <glyph kind="triangle" slot="LL" color="ink"/>
      <value>2</value>
      <text slot="LR" size="small">DE|FT</text>
    </front>
    <back derived="same"/>
  </counter>
  <counter id="us-2-d-2-18" family="unit" name="2/D/2/18">
    <front style="us">
      <text slot="TC" size="medium" weight="bold">2/D/2/18</text>
      <symbol icon="engineer"/>
      <steps count="1" max="1" slot="LCOL" color="white"/>
      <text slot="MR" size="small">1|R2</text>
      <glyph kind="circle" slot="LL" color="ink"/>
      <value>2</value>
      <text slot="LR" size="small">SP</text>
    </front>
    <back derived="same"/>
  </counter>
  <counter id="us-e-2-8" family="unit" name="E/2/8">
    <front style="us">
      <text slot="TC" size="medium" weight="bold">E/2/8</text>
      <symbol icon="infantry"/>
      <steps count="4" max="4" slot="LCOL" color="white"/>
      <text slot="MR" size="small">1|R3</text>
      <glyph kind="diamond" slot="LL" color="ink"/>
      <value>7-2</value>
    </front>
    <back derived="reduced">
      <steps count="3" max="4" slot="LCOL" color="white"/>
      <value>5-2</value>
      <text slot="LR" size="small">BR|RD</text>
    </back>
  </counter>
  <counter id="us-f-2-8" family="unit" name="F/2/8">
    <front style="us">
      <text slot="TC" size="medium" weight="bold">F/2/8</text>
      <symbol icon="infantry"/>
      <steps count="4" max="4" slot="LCOL" color="white"/>
      <text slot="MR" size="small">1|R3</text>
      <glyph kind="circle" slot="LL" color="ink"/>
      <value>7-2</value>
    </front>
    <back derived="reduced">
      <steps count="3" max="4" slot="LCOL" color="white"/>
      <value>5-2</value>
      <text slot="LR" size="small">BR|RD</text>
    </back>
  </counter>
  <counter id="us-2-c-1-18" family="unit" name="2/C/1/18">
    <front style="us">
      <text slot="TC" size="medium" weight="bold">2/C/1/18</text>
      <symbol icon="engineer"/>
      <steps count="1" max="1" slot="LCOL" color="white"/>
      <text slot="MR" size="small">1|R3</text>
      <glyph kind="diamond" slot="LL" color="ink"/>
      <value>2</value>
      <text slot="LR" size="small">DE|FT</text>
    </front>
    <back derived="same"/>
  </counter>
  <counter id="us-2-f-2-18" family="unit" name="2/F/2/18">
    <front style="us">
      <text slot="TC" size="medium" weight="bold">2/F/2/18</text>
      <symbol icon="engineer"/>
      <steps count="1" max="1" slot="LCOL" color="white"/>
      <text slot="MR" size="small">1|R3</text>
      <glyph kind="triangle" slot="LL" color="ink"/>
      <value>2</value>
      <text slot="LR" size="small">SP</text>
    </front>
    <back derived="same"/>
  </counter>
  <counter id="us-l-3-2" family="unit" name="L/3/2">
    <front style="us">
      <text slot="TC" size="medium" weight="bold">L/3/2</text>
      <symbol icon="infantry"/>
      <steps count="4" max="4" slot="LCOL" color="white"/>
      <text slot="MR" size="small">2|R1</text>
      <glyph kind="circle" slot="LL" color="ink"/>
      <value>7-2</value>
    </front>
    <back derived="reduced">
      <steps count="3" max="4" slot="LCOL" color="white"/>
      <value>5-2</value>
      <text slot="LR" size="small">BR|RD</text>
    </back>
  </counter>
  <counter id="us-m-3-2" family="unit" name="M/3/2">
    <front style="us">
      <text slot="TC" size="medium" weight="bold">M/3/2</text>
      <symbol icon="heavy-infantry"/>
      <steps count="4" max="4" slot="LCOL" color="white"/>
      <text slot="MR" size="small">2|R1</text>
      <glyph kind="triangle" slot="LL" color="ink"/>
      <value>8-3</value>
      <text slot="LR" size="small">MG</text>
    </front>
    <back derived="reduced">
      <steps count="3" max="4" slot="LCOL" color="white"/>
      <value>6-3</value>
      <text slot="LR" size="small">MG|MO</text>
    </back>
  </counter>
  <counter id="us-g-2-2" family="unit" name="G/2/2">
    <front style="us">
      <text slot="TC" size="medium" weight="bold">G/2/2</text>
      <symbol icon="infantry"/>
      <steps count="4" max="4" slot="LCOL" color="white"/>
      <text slot="MR" size="small">2|R2</text>
      <glyph kind="triangle" slot="LL" color="ink"/>
      <value>7-2</value>
    </front>
    <back derived="reduced">
      <steps count="3" max="4" slot="LCOL" color="white"/>
      <value>5-2</value>
      <text slot="LR" size="small">BR|RD</text>
    </back>
  </counter>
  <counter id="us-h-2-2" family="unit" name="H/2/2">
    <front style="us">
      <text slot="TC" size="medium" weight="bold">H/2/2</text>
      <symbol icon="heavy-infantry"/>
      <steps count="4" max="4" slot="LCOL" color="white"/>
      <text slot="MR" size="small">2|R2</text>
      <glyph kind="diamond" slot="LL" color="ink"/>
      <value>8-3</value>
      <text slot="LR" size="small">MG</text>
    </front>
    <back derived="reduced">
      <steps count="3" max="4" slot="LCOL" color="white"/>
      <value>6-3</value>